{
  "schema_version": "2.0",
  "id": "simple-1-stage",
  "version": "1.0.0",
  "stages": [
    {
      "id": "stage1",
      "version": "1.0.0",
      "type": "setup",
      "timeout": "60s",
      "resources_required": [
        {
          "type": "cpu",
          "value": 0.1
        },
        {
          "type": "memory",
          "value": "100M"
        }
      ]
    }
  ]
}
